BrefID	SortDate	BibLvlCode	StandardTitle	AbstractEnglish	Refstringauthors	WoScode
287676	2013	AS	The curious case of <i>Hermodice carunculata</i> (Annelida: Amphinomidae): evidence for genetic homogeneity throughout the Atlantic Ocean and adjacent basins	"Over the last few decades, advances in molecular techniques have led to the detection of strong geographic population structure and cryptic speciation in many benthic marine taxa, even those with long-lived pelagic larval stages. Polychaete annelids, in particular, generally show a high degree of population divergence, especially in mitochondrial genes. Rarely have molecular studies confirmed the presence of ‘cosmopolitan’ species. The amphinomid polychaete <i>Hermodice carunculata</i> was long considered the sole species within its genus, with a reported distribution throughout the Atlantic and adjacent basins. However, recent studies have indicated morphological differences, primarily in the number of branchial filaments, between the East and West Atlantic populations; these differences were invoked to re-instate <i>Hermodice nigrolineata</i>, formerly considered a junior synonym of <i>H. carunculata</i>. We utilized sequence data from two mitochondrial (cytochrome c oxidase subunit I, 16S rDNA) markers and one nuclear (internal transcribed spacer) marker to examine the genetic diversity of <i>Hermodice</i> throughout its distribution range in the Atlantic Ocean, including the Mediterranean Sea, the Caribbean Sea, the Gulf of Mexico and the Gulf of Guinea. Our analyses revealed generally low genetic divergences among collecting localities and between the East and West Atlantic, although phylogenetic trees based on mitochondrial data indicate the presence of a private lineage in the Mediterranean Sea. A re-evaluation of the number of branchial filaments confirmed differences between East and West Atlantic populations; however, the differences were not diagnostic and did not reflect the observed genetic population structure. Rather, we suspect that the number of branchial filaments is a function of oxygen saturation in the environment. Our results do not support the distinction between <i>H. carunculata</i> in the West Atlantic and<i> H. nigrolineata </i>in the East Atlantic. Instead, they re-affirm the older notion that <i>H. carunculata </i> is a cohesive species with a broad distribution across the Atlantic Ocean."	"Ahrens, J.B.; Borda, E.; Barroso, R.; Paiva, P.C.; Campbell, A.M.; Wolf, A.; Nugues, M.M.; Rouse, G.W.; Schulze, A."	WOS:000317137200017
287796	2013	AS	Perezoperezone and curcuperezone: bisabolane dimers from the soft coral <i>Pseudopterogorgia rigida</i>	"Perezoperezone (1), curcuperezone (2), and diperezone (3), belonging to the rare class of bisabolane dimers, were isolated as minor constituents of the organic extract of the Caribbean soft coral, <i>Pseudopterogorgia rigida</i>. The structures of the new compounds 1 and 2 were established by detailed analyses of their NMR and MS data."	"Georgantea, P.; Ioannou, E.; Vagias, C.; Roussis, V."	WOS:000327285300030
287837	2013	AS	"Redescription of <i>Ceratothoa carinata</i> (Bianconi, 1869) and <i>Ceratothoa oxyrrhynchaena</i> Koelbel, 1878 (Crustacea: Isopoda: Cymothoidae), buccal-attaching fish parasites new to Australia"	"<i>Ceratothoa carinata</i> (Bianconi, 1869) and <i>Ceratothoa oxyrrhynchaena</i> Koelbel, 1878 are recorded for the first time from Australia and redescribed. <i>Ceratothoa curvicauda</i> Nunomura, 2006 is synonymised with <i>Ceratothoa carinata</i>. Brief ac-counts are given on the distribution and hosts of these species."	"Martin, M.B.; Bruce, N.L.; Nowak, B.F."	WOS:000321292600004
287862	2013	AS	Community structure and species diversity of Harpacticoida (Crustacea: Copepoda) at two sites in the deep sea of the Angola Basin (Southeast Atlantic)	"The aim of this study was to evaluate compositional differences between harpacticoid (Crustacea, Copepoda) assemblages at two widely separated abyssal locations. During the DIVA 1 cruise of RV METEOR (July/August 2000) to the Angola Basin (Southeast Atlantic), two deep-sea stations, approximately 300 nautical miles apart (Stations 325 and 346), were sampled repeatedly by Multicorer (MUC). For quantitative analyses, 5 MUC samples were selected at random from each of 15 deployments at both stations, totalling 75 cores. Across the study, 7,081 Harpacticoida specimens were encountered and of these 31.4 % were adults and could be analysed to species level: 682 species were identified, with 99.3 % new to science. At northern Station 346, a total of 600 species were recorded—the highest harpacticoid species number ever recorded for a single deep-sea locality. Most species (56 %) were represented by singletons. Multivariate tests identified significant differences between community compositions at the two stations. Diversity, species richness and species density were higher at Station 346, whilst taxonomic distinctness, evenness, and rarefaction were similar between stations. Regression and correlation analyses showed that the difference in species diversity was best explained by species densities rather than species richness. Under-sampling due to low densities was an issue at the southern Station 325. Nevertheless, our study demonstrated significant differences in regional-scale harpacticoid community structures within a single deep-sea basin that would usually be considered a uniform and stable habitat. These observed differences are thought to reflect differences in food availability at the two stations."	"George, K.H.; Veit-Köhler, G.; Arbizu, P.M.; Seifried, S.; Rose, A.; Willen, E.; Bröhldick, K.; Corgosinho, P.H.; Drewes, J.; Menzel, L.; Moura, G.; Schminke, H.K."	WOS:000332585400006
287937	2013	AS	"A new species of <i>Perinereis</i> (Polychaeta, Nereididae) from Florida, USA, with a key to all <i>Perinereis</i> from the American continent"	"Specimens belonging to a new species of <i>Perinereis</i> Kinberg, 1865 were collected fromnatural oyster reefs in an estuarine environmenton Florida’s southwest coast. The genus <i>Perinereis</i> includes more than 70 species, of which, <i>Perinereis aibuhitensis</i> (Grube, 1878), <i>Perinereis brevicirrata</i> (Treadwell, 1920), <i>Perinereis camiguinoides</i> (Augener, 1922), <i>Perinereis jascooki</i> Gibbs, 1972, <i>Perinereis kuwaitensis</i> Mohammad, 1970, <i>Perinereis singaporiensis</i> (Grube, 1878), <i>Perinereis vancaurica</i> (Ehlers, 1868) and the new species have two short bars on Area VI and notopodial dorsal ligules that are not greatly expanded. The most geographically close species is <i>Perinereis brevicirrata</i>. The new species can be distinguished from <i>Perinereis brevicirrata</i> by the absence of a notopodial prechaetal lobe, Area V with 3 cones in a triangle, and Area VII-VIII with two well-defined rows of 33 paragnaths, the basal row having longer paragnaths in relation to the distal ones. The new species resembles <i>Perinereis singaporiensis</i> based on the absence of notopodial prechaetal lobe; however, the two species differ in some morphological characteristics such as tentacular cirri length, shape of dorsal notopodial ligules, and falciger blades. A key to all American species of <i>Perinereis</i> is included."	"de Leon, J.; Goethel, C."	WOS:000320986200001
287994	2013	AS	"Description of intertidal macro- and meiobenthic assemblages in Maxwell Bay, King George Island, South Shetland Islands, Southern Ocean"	"The intertidal benthic fauna of the Antarctic coastal areas is largely unknown and has long been thought to be absent or, at most, to be scarce. Since climate changes cause a progressive expansion of ice-free intertidal soft-bottom areas, the fauna of these areas could serve as essential criterion to evaluate the kind and dimension of such changes. We therefore investigated the faunal composition of the intertidal soft-bottom area of Maxwell Bay (King George Island, South Shetlands) in December 2006. Samples for quantitative analyses were taken from the soft-bottom during low tide using a plastic corer. We performed detailed analyses of the soft-bottom beneath a cobble layer, while hard-bottom and macrophytes were only sporadically investigated. Approximately 5,000 specimens were collected of which polychaetes (37.3 ± 7.6 (max. 44.7) ind. × 100 cm?³) and harpacticoids (28.9 ± 28.5 (max. 104.0) ind. × 10 cm?³) were the most abundant macro- and meiofauna taxa of the soft-bottom, followed by oligochaetes, nematodes, mollusks, and amphipods. A total of 58 macrofauna species were registered, of which 27 were identified only to a supraspecific level. The most species-rich macrofauna taxon was polychaetes with at least 24 species, followed by amphipods, gastropods, and oligochaetes with 6 species each. The harpacticoid copepods were represented by 15 families with more than 30 species. In summary, we show that the Antarctic intertidal soft-bottom is densely populated by macro- and meiofauna and that it deserves closer attention in the future to determine whether it can indeed serve as an indicator of the effect of climate changes on the Antarctic coastal areas."	"Bick, A.; Arlt, G."	WOS:000317858500005
288164	2013	AS	Three new records of deep-water goniasterids (Echinodermata: Asteroidea: Goniasteridae) from China seas	"In this paper, three deep-water species of the family Goniasteridae, <i>Ceramaster misakiensis</i> (Goto, 1914), <i>Nymphaster arthrocnemis</i> Fisher, 1913 and <i>Pontioceramus grandis</i> Fisher, 1911, are recorded for the first time from Chinese waters based on collections deposited in the Marine Biological Museum, Chinese Academy of Sciences. The specimens examined were collected during the period 1956 to 1978 from the East China and South China Seas at depths of 184 to 472 m. Diagnosis, detailed figures, and the geographic distributions are provided. A revised list of Goniasteridae recorded from Chinese waters is proposed."	"Xiao, N.; Liao, Y."	WOS:000324111300012
288407	2013	AM	Integrating heterogeneous and distributed information about marine species through a top level ontology	"One of the main characteristics of biodiversity data is its cross-disciplinary feature and the extremely broad range of data types, structures, and semantic concepts which encompasses. Moreover, biodiversity data, especially in the marine domain, is widely distributed, with few well-established repositories or standard protocols for their archiving, access, and retrieval. Our research aims at providing models and methods that allow integrating such information either for publishing it, browsing it, or querying it. For providing a valid and reliable knowledge ground for enabling semantic interoperability of marine data, in this paper we motivate a top level ontology, called MarineTLO that we have designed for this purpose, and discuss its use for creating MarineTLO-based warehouses in the context of a research infrastructure."	"Tzitzikas, Y.; Allocca, C.; Bekiari, C.; Marketakis, Y.; Fafalios, P.; Doerr, M.; Minadakis, N.; Patkos, T.; Candela, L."	\N
288500	2013	AS	"Multi-scale spatio-temporal patchiness of macrozoobenthos in the Sacca di Goro lagoon (Po River Delta, Italy)"	"1 - In this study, the macrobenthos from different habitats in the Sacca di Goro lagoon (Po River Delta, Italy) is analysed by following a multi-scale spatio-temporal approach, with the aim of evaluating the spatial patchiness and stability of macroinvertebrate assemblages in the lagoon. The scale similarity is examined by using a taxonomic metrics based on the Kullback-Leibler divergence and a related index of similarity.2 - Data were collected monthly during one year in four dominant habitat types, which were classified on the basis of main physiognomic traits (type of vegetation and anthropogenic impact). Three of the selected habitats were natural (macroalgal beds, bare sediment and Phragmitetum) and one anthropogenically modified (the licensed area for Manila clam farming). Each habitat was sampled in a variable number of stations representative of specific microhabitats, with three replicates each.3 - Of the 47 taxa identified, only few species were found exclusively in one habitat type, with low densities. No taxon was dominant in all the considered habitats.4 - The results show that, in spite of the large overlapping of species, the spatio-temporal dissimilarity within each habitat type was higher than expected on the basis of the common physiognomic traits. This suggests that local factors (mainly hydrodynamism, quality and quantity of vegetal matter) play a significant role in determining the structure of the macroinvertebrate assemblages.5 - The dissimilarity between habitats was significant and maintained all over the seasonal progression, indicating that the macroinvertebrate assemblages were steadily different. Each habitat allowed some specific taxa to maintain a significant population size, which is a prerequisite for preserving biodiversity.6 - The variety of vegetation types and hydrodynamic conditions in the lagoon emerges as crucial for sustaining biodiversity and capacity to recover from disturbances."	"Ludovisi, A.; Castaldelli, G.; Fano, E.A."	\N
288502	2013	AM	"Estudio de la composición de sitios concheros en la costa north de Santa Cruz (Patagonia, Argentina)"	\N	"Hammond, H.; Zubimendi, M.A."	\N
287712	2013	AS	Spatial analysis of the trophic interactions between two juvenile fish species and their preys along a coastal–estuarine gradient	"Coastal and estuarine systems provide nursery grounds for many marine fish species. Their productivity has been correlated with terrigeneous inputs entering the coastal–estuarine benthic food web, thereby favouring the establishment of fish juveniles. Studies in these ecosystems often describe the nursery as a single large habitat without verifying nor considering the presence of contiguous habitats. Our study aimed at identifying different habitats based on macrozoobenthic communities and morpho-sedimentary characteristics and assessing the trophic interactions between fish juveniles and their benthic preys within these habitats. It included 43 sampling sites covering 5 habitats in which we described taxonomically and quantitatively the invertebrates and fish communities with stable isotopes and gut contents. It suggested that the benthic common sole <i>Solea solea</i> displayed feeding plasticity at the population level, separating the juveniles (G0) from the older fish (G1) into different “feeding sub-populations”. Size-based feeding plasticity was also observable in the spatial occupancy of that species in the studied bay. The demersal pouting, <i>Trisopterus luscus</i>, equally used the different habitats but displayed low feeding plasticity across and inside each habitat. Stable isotopes proved to be powerful tools to study the spatial distribution of trophic interactions in complex ecosystems like the bay of Vilaine and to define optimal habitats for fish that use the coastal–estuarine ecosystem as nursery grounds."	"Kopp, D.; Le Bris, H.; Grimaud, L.; Nérot, C.; Brind'Amour, A."	WOS:000320355700005
287751	2013	AS	An inventory of natural resources harvested from national parks in South Africa	"Resource harvesting is permissible within South African protected areas under certain conditions as part of benefit sharing that seeks to strengthen relationships with communities living adjacent to parks. However, not all resource use is authorised and little is currently known about what is harvested, or the extent and impacts of harvesting in parks. This limits capacity to monitor and set the boundaries for such use. This paper provides a checklist of resources harvested within each of 19 national parks managed by South African National Parks. Data were gathered by means of a question-based survey of park staff. A database detailing the parks from which each resource was harvested and its purpose(s) was compiled, representing the most comprehensive list of resources harvested from parks to date. A total of 382 harvested biological and abiotic resources (284 terrestrial and 98 aquatic), used for a wide range of purposes, were identified across parks. Many of the resources, especially animals (96%), were harvested destructively. The strongest motivation for harvest was subsistence, although most resources were also used for financial gain through informal business. Although current data are not sufficient to determine harvest sustainability for most resources, better data and increased awareness of resource use activities will enable future research to this end."	"Van Wilgen, N.J.; Dopolo, M.; Symonds, A.; McGeoch, M.A."	WOS:000321300700005
287817	2013	AS	A decadal view of biodiversity informatics: challenges and priorities	"Biodiversity informatics plays a central enabling role in the research community's efforts to address scientific conservation and sustainability issues. Great strides have been made in the past decade establishing a framework for sharing data, where taxonomy and systematics has been perceived as the most prominent discipline involved. To some extent this is inevitable, given the use of species names as the pivot around which information is organised. To address the urgent questions around conservation, land-use, environmental change, sustainability, food security and ecosystem services that are facing Governments worldwide, we need to understand how the ecosystem works. So, we need a systems approach to understanding biodiversity that moves significantly beyond taxonomy and species observations. Such an approach needs to look at the whole system to address species interactions, both with their environment and with other species. It is clear that some barriers to progress are sociological, basically persuading people to use the technological solutions that are already available. This is best addressed by developing more effective systems that deliver immediate benefit to the user, hiding the majority of the technology behind simple user interfaces. An infrastructure should be a space in which activities take place and, as such, should be effectively invisible. This community consultation paper positions the role of biodiversity informatics, for the next decade, presenting the actions needed to link the various biodiversity infrastructures invisibly and to facilitate understanding that can support both business and policy-makers. The community considers the goal in biodiversity informatics to be full integration of the biodiversity research community, including citizens’ science, through a commonly-shared, sustainable e-infrastructure across all sub-disciplines that reliably serves science and society alike."	"Hardisty, A.; Roberts, D."	WOS:000318501200001
287844	2013	AS	Bioactive polyhydroxylated sterols from the marine sponge <i>Haliclona crassiloba</i>	"Four new polyhydroxylated sterols, named halicrasterols A–D (1–4), together with six known analogs (5–10) were isolated from the marine sponge <i>Haliclona crassiloba</i>. Compounds 1 and 2 represented rare examples of steroids featuring 17(20)<i>E</i>-double bonds. The structures of 1–10 were elucidated by spectroscopic analysis and comparison with reported data. This is the first report of a steroid profile for this species. The antimicrobial activities of 1–10 were evaluated against a panel of bacterial and fungal strains <i>in vitro</i>, and compounds 4 and 9 showed moderate activity against some of the Gram-positive strains with MICs ranging from 4 to 32 ?g/mL."	"Cheng, Z.-B.; Xiao, H.; Fan, C.-Q.; Lu, Y.-N.; Zhang, G.; Yin, S."	WOS:000328303300007
287846	2013	AS	"<i>Methanobacterium movilense</i> sp. nov., a hydrogenotrophic, secondary-alcohol-utilizing methanogen from the anoxic sediment of a subsurface lake"	"A novel strain of methanogenic archaea, designated MC-20<sup>T</sup>, was isolated from the anoxic sediment of a subsurface lake in Movile Cave, Mangalia, Romania. Cells were non-motile, Gram-stain-negative rods 3.5–4.0 µm in length and 0.6–0.7 µm in width, and occurred either singly or in short chains. Strain MC-20<SUP>T</SUP> was able to utilize H<sub>2</sub>/CO<sub>2</sub>, formate, 2-propanol and 2-butanol as substrate, but not acetate, methanol, ethanol, dimethyl sulfide, monomethylamine, dimethylamine or trimethylamine. Neither trypticase peptone nor yeast extract was required for growth. The major membrane lipids of strain MC-20<SUP>T</SUP> were archaeol phosphatidylethanolamine and diglycosyl archaeol, while archaeol phosphatidylinositol and glycosyl archaeol were present only in minor amounts. Optimal growth was observed at 33 °C, pH 7.4 and 0.08 M NaCl. Based on phylogenetic analysis of 16S rRNA gene sequences, strain MC-20<SUP>T</SUP> was closely affiliated with <i>Methanobacterium oryzae</i> FPiT (similarity 97.1?%) and <i>Methanobacterium lacus</i> 17A1T (97.0?%). The G+C content of the genomic DNA was 33.0 mol%. Based on phenotypic and genotypic differences, strain MC-20<SUP>T</SUP> was assigned to a novel species of the genus <i>Methanobacterium</i> for which the name <i>Methanobacterium movilense</i> sp. nov. is proposed. The type strain is MC-20<SUP>T</SUP> (?=?DSM 26032<sup>T</sup>?=?JCM 18470<sup>T</sup>)."	"Schirmack, J.; Mangelsdorf, K.; Ganzert, L.; Sand, W.; Hillebrand-Voiculescu, A.; Wagner, D."	WOS:000337930800030
287887	2013	AS	Spatial stability of macrobenthic seagrass biodiversity	"The magnitude and patchiness of macrobenthic biodiversity were compared across spatial scales spanning 5 orders of areal magnitude (ca. 2 m<sup>2</sup> to ca. 1.5 ha) in an intertidal seagrass bed in the warm-temperate Knysna estuarine bay, South Africa. The 75 component species and their populations were highly variably distributed across the site, abundances of the individual dominant animals being significantly patchy and composition of the macrofaunal assemblage being significantly non-uniform. Nevertheless, emergent assemblage attributes exhibited spatial constancy: values of assemblage metrics (faunal abundance, species richness, species density and species diversity) did not differ across the site or across spatial scales, and neither did the patterns of dispersion of species diversity, species richness or observed species density. Distribution of the 2 latter through space was even significantly uniform. Ecological arguments developed for temporal constancy of biodiversity seem broadly applicable to the spatial dimension at Knysna, suggesting that although apparently paradoxical, it may be the varying assemblage composition that permits this spatial stability. There is no evidence, however, that the Knysna seagrass macrobenthos is a competitively-structured assemblage with rigid niche-partitioning, a condition suggested to be necessary for temporal constancy; rather, it is more likely to be open, non-equilibrium and below carrying capacity."	"Barnes, R.S.K."	WOS:000327197700012
287985	2013	AS	Definition of species groups of Oncaeidae (Copepoda: Cyclopoida) as basis for a worldwide identification key	"The copepod family Oncaeidae is widely distributed in the world's oceans and includes many small and abundant species. Due to their small size and the existence of sister and sibling species in different parts of the ocean, species identification is very difficult. Quantitative studies on copepod communities usually consider oncaeids at the family level only, or present uncertain species names, when based on regional identification keys not established for the study area. This paper aims to develop the basis for an improved taxonomic resolution of oncaeids in ecological studies. It summarizes the most relevant morphological elements to characterize the seven presently known genera and to define in addition 16 species groups within the paraphyletic taxon <i>Oncaea</i> s.l. On this basis, a worldwide identification key for oncaeids is presently being developed, restricted to genera and species groups, with species included as far as the state of knowledge allows."	"Böttger-Schnack, R.; Schnack, D."	WOS:000316104500002
288010	2013	AS	"The contrasted evolutionary fates of deep-sea chemosynthetic mussels (Bivalvia, Bathymodiolinae)"	"Bathymodiolinae are giant mussels that were discovered at hydrothermal vents and harboring chemosynthetic symbionts. Due to their close phylogenetic relationship with seep species and tiny mussels from organic substrates, it was hypothesized that they gradually evolved from shallow to deeper environments, and specialized in decaying organic remains, then in seeps, and finally colonized deep-sea vents. Here, we present a multigene phylogeny that reveals that most of the genera are polyphyletic and/or paraphyletic. The robustness of the phylogeny allows us to revise the genus-level classification. Organic remains are robustly supported as the ancestral habitat for Bathymodiolinae. However, rather than a single step toward colonization of vents and seeps, recurrent habitat shifts from organic substrates to vents and seeps occurred during evolution, and never the reverse. This new phylogenetic framework challenges the gradualist scenarios “from shallow to deep.” Mussels from organic remains tolerate a large range of ecological conditions and display a spectacular species diversity contrary to vent mussels, although such habitats are yet underexplored compared to vents and seeps. Overall, our data suggest that for deep-sea mussels, the high specialization to vent habitats provides ecological success in this harsh habitat but also brings the lineage to a kind of evolutionary dead end."	"Thubaut, J.; Puillandre, N.; Faure, B.; Cruaud, C.; Samadi, S."	WOS:000327304000012
