BrefID	SortDate	BibLvlCode	StandardTitle	AbstractEnglish	Refstringauthors	WoScode
238222	2013	AS	"New genus and two new species of the family Ethmolaimidae (Nematoda: Chromadorida), found in two different cold-seep environments"	"This study describes a new genus <i>Dystomanema</i> <b>gen. nov.</b> with two new species, <i>D. cadizensis</i><b> sp. nov.</b> and <i>D. brandtae</i> <b>sp. nov.</b> within the family Ethmolaimidae, subfamily Neotonchinae, based on specimens from two low-activity cold-seep environments at distant geographical locations. The new genus was first identified in samples from the Darwin mud vol-cano (1100 m depth) in the Gulf of Cádiz and later on also found in samples from a low-activity seep in the Larsen B embayment (820m depth) off the eastern Antarctic Peninsula. Until now, the family Ethmolaimidae contained nine genera: <i>Ethmolaimus</i> and <i>Paraethmolaimus</i> in the subfamily Ethmolaiminae, and <i>Comesa, Filitonchoides, Filitonchus, Gomphionchus, Gomphionema, Nannolaimus</i>, and <i>Neothonchus</i> in the subfamily Neotonchinae. The most important family characteristics are: an annulated cuticle bearing transverse rows of dots, cephalic sensilla arrangement of 6+6+4, a spiral amphid, an oesophagus with muscular posterior bulb, paired gonads and males with cup-shaped precloacal supplements. The new genus resembles <i>Comesa</i> and <i>Neotonchus</i>, but is typified by a ventrally displaced oral opening with three very small teeth that are easily overlooked. <i>D. cadizensis</i><b> gen. nov. sp. nov.</b> is characterized by the 1401–2123 µm long body; cuticle transversally striated with fine punctation; head conical; low lips; amphid spiralled 3 turns, oral opening ventrally displaced, male with outstretched testes; spicules of equal size; gubernaculum plate-like and ten to twelve con-spicuous cup-shaped precloacal supplements with external longitudinal articulated flange. <i>D. brandtae</i><b> gen. nov. sp. nov.</b> can be distinguished by the 2438–3280 µm long body; cuticle transversally striated with fine punctuation; head conical; low lips; amphid spiraled 3+ turns; oral opening ventrally displaced; male with anterior testes outstretched and posterior one smaller and reflexed; spicules of equal size; gubernaculum plate-like and twenty conspicuous cup-shaped precloacal supplements with external longitudinal articulated flange. Notes on the ecology and habitat of the new genus are provided in light of its discovery in cold-seep environments."	"Bezerra, T.N.; Pape, E.; Hauquier, F.; Vanreusel, A.; Ingels, J."	WOS:000322226500002
238311	2013	AS	Selective settlement of deep-sea canyon nematodes after resuspension - an experimental approach	"Dispersal processes are known to influence dynamics of marine benthic communities. It has been argued that as a result of nematodes being small in size and lacking pelagic larvae, it is unlikely that they are able to disperse actively over wide geographical ranges. Nematode dispersal is therefore assumed to be predominantly driven by water currents entraining resuspended sediments containing nematodes. Three different types of substrates combined with sediment (algae, bacteria, and sulphides) and two different controls (empty and azoic sediment) were offered to a nematode community sinking through the water column in three independent, simultaneously running replicated experiments. Selective settlement of nematodes was observed whilst descending in the water column under ex-situ experimental conditions using samples collected in the Whittard canyon at 812 m of water depth. Significant differences in nematode community structure between treatments suggest that different nematodes are attracted by different substrates. They may colonise suitable patches selectively when descending in the water column, but whether they are attracted by food or by other attractants, such as pheromones or other chemical signals, is still unclear. High abundances of the chemosynthetic, mouthless nematode <i>Astomonema</i> found in the canyon study area over medium-scale distances (10-100 m) contribute to the idea that resuspension events enable dispersal of nematodes over larger distances, after which active settlement can occur through chemical attraction."	"Lins, L.; Vanreusel, A.; Van Campenhout, J.; Ingels, J."	WOS:000316715000015
244908	2013	MS	How different are subtidal <i>Mytilus edulis</i> L. communities of natural mussel beds and mussel culture plots in the western Dutch Wadden Sea?	\N	"Drent, J.; Dekker, R."	\N
253006	2013	AS	Linking micro- and macro-evolution at the cell type level: a view from the lophotrochozoan Platynereis dumerilii	"Ever since the origin of the first metazoans over 600 million years ago, cell type diversification has been driven by micro-evolutionary processes at population level, leading to macro-evolution changes above species level. In this review, we introduce the marine annelid <i>Platynereis dumerilii</i>, a member of the lophotrochozoan clade (a key yet most understudied superphylum of bilaterians), as a suitable model system for the simultaneous study, at cellular resolution, of macro-evolutionary processes across phyla and of micro-evolutionary processes across highly polymorphic populations collected worldwide. Recent advances in molecular and experimental techniques, easy maintenance and breeding, and the fast, synchronous and stereotypical development have facilitated the establishment of <i>Platynereis</i> as one of the leading model species in the eco–evo–devo field. Most importantly, <i>Platynereis</i> allows the combination of expression profiling, morphological and physiological characterization at the single cell level. Here, we discuss recent advances in the collection of –omics data for the lab strain and for natural populations collected world-wide that can be integrated with population-specific cellular analyses to result in a cellular atlas integrating genetic, phenotypic and ecological variation. This makes <i>Platynereis</i> a tractable system to begin understanding the interplay between macro- and micro-evolutionary processes and cell type diversity."	"Simakov, O.; Larsson, T.A.; Arendt, D."	WOS:000324777500006
253021	2013	AS	"First record of the warty oreo, <i>Allocyttus verrucosus</i> (Gilchrist, 1906), in Greenland waters"	\N	"Kloppmann, M.H.F.; Thiel, R."	WOS:000316223900022
253008	2013	AS	Large-scale spatial distribution patterns of gastropod assemblages in rocky shores	"Gastropod assemblages from nearshore rocky habitats were studied over large spatial scales to (1) describe broad-scale patterns in assemblage composition, including patterns by feeding modes, (2) identify latitudinal pattern of biodiversity, i.e., richness and abundance of gastropods and/or regional hotspots, and (3) identify potential environmental and anthropogenic drivers of these assemblages. Gastropods were sampled from 45 sites distributed within 12 Large Marine Ecosystem regions (LME) following the NaGISA (Natural Geography in Shore Areas) standard protocol (www.nagisa.coml.org). A total of 393 gastropod taxa from 87 families were collected. Eight of these families (9.2%) appeared in four or more different LMEs. Among these, the Littorinidae was the most widely distributed (8 LMEs) followed by the Trochidae and the Columbellidae (6 LMEs). In all regions, assemblages were dominated by few species, the most diverse and abundant of which were herbivores. No latitudinal gradients were evident in relation to species richness or densities among sampling sites. Highest diversity was found in the Mediterranean and in the Gulf of Alaska, while highest densities were found at different latitudes and represented by few species within one genus (e.g. Afrolittorina in the Agulhas Current, Littorina in the Scotian Shelf, and Lacuna in the Gulf of Alaska). No significant correlation was found between species composition and environmental variables (r <= 0.355, p>0.05). Contributing variables to this low correlation included invasive species, inorganic pollution, SST anomalies, and chlorophyll-a anomalies. Despite data limitations in this study which restrict conclusions in a global context, this work represents the first effort to sample gastropod biodiversity on rocky shores using a standardized protocol across a wide scale. Our results will generate more work to build global databases allowing for large-scale diversity comparisons of rocky intertidal assemblages."	"Miloslavich, P.; Cruz-Motta, J.J.; Klein, E.; Iken, K.; Weinberger, V.; Konar, B.; Trott, T.; Pohle, G.; Bigatti, G.; Benedetti-Cecchi, L.; Shirayama, Y.; Mead, A.; Palomo, G.; Ortiz, M.; Gobin, J.F.; Sardi, A.; Diaz, J.M.; Knowlton, A.; Wong, M.; Peralta, A.C."	WOS:000323115800056
253010	2013	AS	"Response to Comments on ""Can we name Earth's species before they go extinct?"""	\N	"Costello, M.J.; May, R.M.; Stork, N.E."	WOS:000321959300024
253012	2013	AS	"Microbes, mud and methane: cause and consequence of recurrent Early Jurassic anoxia following the end-Triassic mass extinction"	"The end-Triassic mass extinction (<i>c</i>. 201.6 Ma) was one of the five largest mass-extinction events in the history of animal life. It was also associated with a dramatic, long-lasting change in sedimentation style along the margins of the Tethys Ocean, from generally organic-matter-poor sediments during the Triassic to generally organic-matter-rich black shales during the Jurassic. New core material from Germany provides biomarker evidence of persistent photic-zone euxinia during the Hettangian, the onset of which is associated with a series of both negative and positive carbon isotope excursions. Combined inorganic and organic geochemical and micropalaeontological analyses reveal strong similarities between the Hettangian and the better-known Toarcian anoxic event. These events appear to be the most clearly expressed events within a series of anoxic episodes that also include poorly studied black shale intervals during the Sinemurian and Pliensbachian. Both the Hettangian and Toarcian events are marked by important changes in phytoplankton assemblages from chromophyte- to chlorophyte-dominated assemblages within the European Epicontinental Seaway. Phytoplankton changes occurred in association with the establishment of photic-zone euxinia, driven by a general increase in salinity stratification and warming of surface waters. For both events, the causes of large negative carbon isotope excursions remain incompletely understood; evidence exists for both variation in the d<sup>13</sup>C of atmospheric CO<sub>2</sub> and variation in the sources of organic carbon. Regardless of the causes of d<sup>13</sup>C variability, long-term ocean anoxia during the Early Jurassic can be attributed to greenhouse warming and increased nutrient delivery to the oceans triggered by flood basalt volcanism."	"van de Schootbrugge, B.; Bachan, A.; Suan, G.; Richoz, S.; Payne, J.L."	WOS:000321832100002
253017	2013	AS	Pelagic propagule duration and developmental mode: reassessment of a fading link	"Aim As the main or sole motile stage of many aquatic taxa, propagules play a central role in their population dynamics, macroevolution and biogeography. The premises of studies concerned with dispersal, on issues as diverse as marine protected areas, sustainable fisheries and invasive species, commonly make simplified assumptions linking larval development mode (planktotrophic, lecithotrophic) and pelagic propagule duration (PPD) or pelagic larval duration. Because general empirical tests of these connections have yielded equivocal results, we critically examined the relationship between larval mode and PPD in light of regional and taxon-specific criteria. Location Oceans world-wide. Methods We collated data from 190 species from the phylum Echinodermata and used two-way and one-way ANOVA to compare PPD among larval modes, taxonomic classes, geographic regions and climate zones. We also assessed the contribution of egg size, temperature and other continuous predictors using multiple regressions and ANCOVA, and examined whether geographic range size differed among larval modes. Results Our results depart from the common assumption that planktotrophs have longer PPDs than lecithotrophs. Instead, we detected a synergistic influence of phylogeny and climate. No significant difference in PPD between planktotrophs and lecithotrophs occurred in two of the four classes and only four out of nine major ocean basins contained species with significantly different PPDs on the basis of larval mode. Species from colder climates displayed relatively constant PPDs regardless of larval mode, whereas temperate and warm-water species displayed a clearer dichotomy. PPD did not correlate with geographic range size nor did planktotrophs and lecithotrophs exhibit significantly different range sizes. Main conclusions Our findings indicate that larval mode is not a reliable predictor of PPD across broad geographic and taxonomic scales. Instead developmental strategies may instigate shorter or longer PPDs in schemes that are influenced by evolutionary and environmental pressures."	"Mercier, A.; Sewell, M.A.; Hamel, J.-F."	WOS:000317673200001
253019	2013	AS	Improving bathymetric images exploration: a data mining approach	"Bathymetry is the science of measuring and charting the depths to determine the topography of the seafloor and other bodies of water. It has several important practical and academic applications. For this reason, having computational tools capable of analyzing bathymetric charts would be useful for domain experts studying the various problems related to water depth. Data mining is a well known technique for extracting information from large datasets, but cannot be directly applied to images. The contribution of this work is an approach for using data mining in bathymetry images. We propose a method for processing input images, in order to extract records and their features, which can be processed by classic data mining algorithms. Additionally, we also propose techniques to visualize both data mining results and map characteristics. For evaluation purposes, the proposed approach was applied to a cold-water corals dataset, in order to predict where corals are likely to be found, under a domain expert supervision."	"Gonzalez, L.F.P.; Pivel, M.A.G.; Ruiz, D.D.A."	WOS:000318376900016
254597	2013	M	Data to inform the CBD North Pacific regional workshop to facilitate the description of ecologically or biologically significant marine areas	\N	"Halpin, P.; Cleary, J.; Curtice, C.; Donnelly, B.; Dunn, D.; Roberts, J."	\N
254656	2013	AS	Applying distribution model projections for an uncertain future: the case of the Pacific oyster in UK waters	"    The inherent complexity of the environment is such that attempts to model it must operate under simplifications and assumptions. Considering predictions from alternative models, with a range of assumptions and data requirements, therefore provides a more robust approach.    The intractability and uncertainty resulting from a suite of predictions may hinder the application of science in policy, where a single prediction with little ambiguity or uncertainty would be most desirable. Few studies modelling species' distributions attempt to present multi-model outputs in a format most useful to the non-modelling community, and none of these have done so for the marine environment.    The problem of uncertainty is particularly prevalent in predicting the distribution of invasive alien species under climate change. As invasive alien species are one of the main drivers of biodiversity loss and may incur significant economic costs, the benefit of applying predictions to highlight areas of possible establishment and inform policy and management may be large.    An ensemble prediction is used to assess the distribution of suitable habitat for the Pacific oyster, Crassostrea gigas, in UK waters both currently and in the future. The ensemble incorporates predictions from three species distribution models, using data from two global climate models. A method is developed highlighting the agreement of the ensemble, further applying threshold values to retain information from constituent predictions in the final map of agreement.    Ensemble predictions made here suggest that Pacific oyster will experience an opening of suitable habitat in northern UK waters, reaching the Faroe Islands and the eastern Norwegian Sea by 2050. Habitat suitability will increase with warming temperatures in the English Channel and Central North Sea for this species. The approaches applied here can be incorporated into risk assessment frameworks for invasive species, as stipulated in the Convention on Biological Diversity."	"Jones, M.C.; Dye, S.R.; Pinnegar, J.K.; Warren, R.; Cheung, W.W.L."	WOS:000325228300007
253009	2013	AS	Plumbing the depths: extending ecological niche modelling and species distribution modelling in three dimensions	"Aim Ecological niche modelling (ENM) and species distribution modelling (SDM) have been used extensively to study biogeographic and macroecological patterns of terrestrial fauna and flora. Few studies to date have applied ENM and SDM to marine ecosystems, and those that have treated the marine environment as a two-dimensional space owing to limitations of the implementations of current ENM/SDM tools. For many marine organisms, ENM/SDM should be performed in three-dimensional space, taking into account latitude, longitude and depth. We present a case study demonstrating a strategy for three-dimensional ENM/SDM. Location Open ocean; global. Methods We decompose the three-dimensional structure of marine environmental and species occurrence data into a series of two-dimensional spaces using an easy-to-implement transformation, after which existing ENM/SDM tools can be used to analyse the data. We demonstrate our approach by modelling the potential distribution of a deep-sea-dwelling jellyfish with two commonly used algorithms. Potential effects of missing data and spatial sampling biases were assessed using resampling approaches. Results We demonstrate that it is feasible to derive predictive models of three-dimensional distributions of marine species using existing software tools developed with two-dimensional terrestrial situations in mind. The strategy presented here allowed us to model the distribution of a jellyfish species that inhabits the deep sea. We assessed the effects of missing occurrence data and spatial bias of occurrence data, and found that interpolation among occurrence data-points and extrapolation into unsampled conditions present distinct challenges that may require different modelling algorithms and interpretations. Main conclusions Our modified ENM/SDM approach is straightforward, and can be used to model situations that have heretofore been beyond the reach of ENM/SDM applications. In particular, geographic distributions and ecological niches of organisms inhabiting three-dimensional habitats such as water columns in marine and freshwater environments can be modelled using the framework presented here."	"Bentlage, B.; Peterson, A.T.; Barve, N.; Cartwright, P."	WOS:000321262100006
253027	2013	AS	Can we name Earth's species before they go extinct?	"Some people despair that most species will go extinct before they are discovered. However, such worries result from overestimates of how many species may exist, beliefs that the expertise to describe species is decreasing, and alarmist estimates of extinction rates. We argue that the number of species on Earth today is 5 +/- 3 million, of which 1.5 million are named. New databases show that there are more taxonomists describing species than ever before, and their number is increasing faster than the rate of species description. Conservation efforts and species survival in secondary habitats are at least delaying extinctions. Extinction rates are, however, poorly quantified, ranging from 0.01 to 1% (at most 5%) per decade. We propose practical actions to improve taxonomic productivity and associated understanding and conservation of biodiversity."	"Costello, M.J.; May, R.M.; Stork, N.E."	WOS:000313960700034
254213	2013	AS	Latitudinal diversity of sea anemones (Cnidaria: Actiniaria)	"We sought to determine if the global distribution of sea anemones (cnidarian order Actiniaria) conforms to the classic pattern of biogeography-taxon richness at the equator with attenuation toward the poles-a pattern that is derived almost entirely from data on terrestrial plants and animals. We plotted the empirical distribution of species occurrences in 10 degrees bands of latitude based on published information, then, using the Chao2 statistic, inferred the completeness of that inventory. We found the greatest species richness of sea anemones at 30-40 ° N and S, with lower numbers at tropical latitudes and the fewest species in polar areas. The Chao2 statistic allowed us to infer that the richness pattern we found is not due to particularly poor knowledge of tropical sea anemones. No 10 degrees band of latitude has less than 60% of the theoretical number of species known, but for only about half of them could we reject the null hypothesis (P = 0.05) that information is complete; anemone diversity is best documented at high latitudes. We infer that the 1089 valid species currently known constitute about 70% of the theoretical total of about 1500 species of Actiniaria. The distribution pattern of sea anemone species resembles that of planktonic foraminiferans and benthic marine algae, although planktonic bacteria, marine bivalves, and shallow and deep scleractinian corals show the terrestrial pattern of equatorial richness attenuating with latitude. Sea anemone species richness is complementary to that of scleractinian corals at many scales; our findings affirm it at the global scale."	"Fautin, D.G.; Malarky, L.; Soberón, J."	WOS:000319492100004
254764	2013	AM	Aspects of global distribution of six marine bivalve mollusc families	\N	"Saeedi, H.; Costello, M.J."	\N
242449	2013	AS	European Journal of Taxonomy: a public collaborative project in Open Access scholarly communication	"Most natural history institutions in Europe have been scientific publishers since their foundation and have a long scholarly publishing tradition. Nowadays, they are confronted with rapid technological developments and face complex strategic and technical questions related to visibility, access, format, and the financial structure of their titles. These issues require a common vision and an international strategy to ensure that the community acts in a consistent and coordinated way. A consortium of institutions is thus launching the European Journal of Taxonomy to provide an alternative public open-access business model, where neither authors nor readers have to pay fees for subscriptions or publication. This paper focuses on the benefits for the institutions on taking greater control over their communication process. "	"Bénichou, L.; Martens, K.; Higley, G.; Gérard, I.; Dessein, S.; Duin, D.; Costello, M.J."	\N
244267	2013	MS	A global assessment of offshore mariculture potential from a spatial perspective	\N	"Kapetsky, J.M.; Aguilar-Manjarrez, J.; Jenness, J."	\N
253031	2013	AS	Global marine plankton functional type biomass distributions: coccolithophores	"Coccolithophores are calcifying marine phytoplankton of the class Prymnesiophyceae. They are considered to play an import role in the global carbon cycle through the production and export of organic carbon and calcite. We have compiled observations of global coccolithophore abundance from several existing databases as well as individual contributions of published and unpublished datasets. We make conservative estimates of carbon biomass using standardised conversion methods and provide estimates of uncertainty associated with these values. The quality-controlled database contains 57 321 individual observations at various taxonomic levels. This corresponds to 11 503 observations of total coccolithophore abundance and biomass. The data span a time period of 1929–2008, with observations from all ocean basins and all seasons, and at depths ranging from the surface to 500 m. Highest biomass values are reported in the North Atlantic, with a maximum of 127.2 µg C L<sup>-1</sup>. Lower values are reported for the Pacific (maximum of 20.0 µg C L<sup>-1</sup>) and Indian Ocean (up to 45.2 µg C L<sup>-1</sup>). Maximum biomass values show peaks around 60° N and between 40 and 20° S, with declines towards both the equator and the poles. Biomass estimates between the equator and 40° N are below 5 µg C L<sup>-1</sup>. Biomass values show a clear seasonal cycle in the Northern Hemisphere, reaching a maximum in the summer months (June–July). In the Southern Hemisphere the seasonal cycle is less evident, possibly due to a greater proportion of low-latitude data. The original and gridded datasets can be downloaded from Pangaea (http://dx.doi.org/10.1594/PANGAEA.785092)."	"O'Brien, C.J.; Peloquin, J.A.; Vogt, M.; Heinle, M.; Gruber, N.; Ajani, P.; Andruleit, H.; Aristegui, J.; Beaufort, L.; Estrada, M.; Karentz, D.; Kopczynska, E.; Lee, R.; Poulton, A.J.; Pritchard, T.; Widdicombe, C."	WOS:000209415500003
