BrefID	SortDate	BibLvlCode	StandardTitle	AbstractEnglish	Refstringauthors	WoScode
218419	2013	AS	"<i>Nebalia pseudotroncosoi</i> n. sp. (Malacostraca: Leptostraca), from South Korea, with a peculiar sexual dimorphism"	"A new crustacean, Nebalia pseudotroncosoi n. sp. (Malacostraca: Leptostraca) occurs along the southern coasts of Korea. The specimens were collected by light traps in harbors where the bottom consisted of fine sand with some algal mats. The new taxon is distinguished from all other known species of Nebalia by the following characteristics: a rectangular compound eye with two to three small distal lobes; an antennular flagellum that is clearly shorter than the peduncle, with up to 10 articles; the fourth article of the antennular peduncle has only two distal thick setae; the antennular scale is nearly oval with a length that is 1.8 times the width; the second article of the mandibular palp has three distally plumose setae; pleonites 3 to 7 have rounded denticles along their posterior dorsal margins; and the protopod of pleopod 4 lacks serration along the posterior margin. We discuss sexual dimorphism in the genus Nebalia and propose the necessity of describing male traits when reporting new species. We also provide partial sequences of the mitochondrial cytochrome c oxidase subunit 1 (CO1) gene from the new species that can be used as a molecular diagnostic characteristic."	"Song, J.-H.; Moreira, J.; Min, G.-S."	WOS:000320680900012
221936	2013	AS	Fewer creatures under the sea	"Previous estimates of there being well over 1 million marine species appear 'improbable', says a team of 120 taxonomists led by Ward Appeltans of UNESCO's Intergovernmental Oceanographic Commission (UNESCO-IOC). They have just published a study based on the World Register of Marine Species (WoRMS), a database hosted by the Flanders Marine Institute in Oostende (Belgium) which the team of taxonomists helped to launch. "	\N	\N
222812	2013	AMS	EurOBIS as biogeographic data system for the European Marine Observation and Data Network (EMODnet)	\N	"Claus, S.; Vandepitte, L.; Waumans, F.; Vanhoorne, B.; Hernandez, F."	\N
222830	2013	AMS	The Flemish contributions to LifeWatch	\N	"Dekeyzer, S.; Deneudt, K.; Vandepitte, L.; Goffin, A.; Claus, S.; Hernandez, F."	\N
224272	2013	AS	Synthesis of knowledge on marine biodiversity in European seas: from census to sustainable management	"The recently completed European Census of Marine Life, conducted within the framework of the global Census of Marine Life programme (2000–2010), markedly enhanced our understanding of marine biodiversity in European Seas, its importance within ecological systems, and the implications for human use. Here we undertake a synthesis of present knowledge of biodiversity in European Seas and identify remaining challenges that prevent sustainable management of marine biodiversity in one of the most exploited continents of the globe. Our analysis demonstrates that changes in faunal standing stock with depth depends on the size of the fauna, with macrofaunal abundance only declining with increasing water depth below 1000 m, whilst there was no obvious decrease in meiofauna with increasing depth. Species richness was highly variable for both deep water macro- and meio- fauna along latitudinal and longitudinal gradients. Nematode biodiversity decreased from the Atlantic into the Mediterranean whilst latitudinal related biodiversity patterns were similar for both faunal groups investigated, suggesting that the same environmental drivers were influencing the fauna. While climate change and habitat degradation are the most frequently implicated stressors affecting biodiversity throughout European Seas, quantitative understanding, both at individual and cumulative/synergistic level, of their influences are often lacking. Full identification and quantification of species, in even a single marine habitat, remains a distant goal, as we lack integrated data-sets to quantify these. While the importance of safeguarding marine biodiversity is recognised by policy makers, the lack of advanced understanding of species diversity and of a full survey of any single habitat raises huge challenges in quantifying change, and facilitating/prioritising habitat/ecosystem protection. Our study highlights a pressing requirement for more complete biodiversity surveys to be undertaken within contrasting habitats, together with investigations in biodiversity-ecosystem functioning links and identification of separate and synergistic/cumulative human-induced impacts on biodiversity."	"Narayanaswamy, B.E.; Coll, M.; Danovaro, R.; Davidson, K.; Ojaveer, H.; Renaud, P.E."	WOS:000316411600015
226874	2013	MS	Navigating the Future IV	\N	European Marine Board	\N
228662	2013	AM	"General introduction, objectives, outline of the thesis"	\N	"Lescrauwaet, A.-K."	\N
229012	2013	AMS	Connecting biodiversity data during the IPY: The path towards e-polar science	"The International Polar Year (IPY) was a unprecedented effort in polar research committing thousands of participants from many nations (Carlson 2010), with a common objective: to describe and understand complex systems using multiple approaches, in an integrated fashion. IPY scientists have collected enormous amounts of data in many formats, ranging from multimedia, hourly to millennial time series, isotope ratios and fractions, energy and material fluxes, species identification and distribution patterns, disease types and rates, genetic sequences, samples identifiers, singular events and gradual processes, to sociological studies (Carlson 2011)."	"Danis, B.; Van de Putte, A.; Renaudier, S.; Griffiths, H."	\N
229319	2013	AMS	"Marine biogeographic data in EurOBIS: assessing their quality, completeness and fitness for use"	\N	"Vandepitte, L.; Waumans, F.; Tyberghein, L.; Vanhoorne, B.; Hernandez, F."	\N
229437	2013	AS	Fine-scale catch data reveal clusters of large predators in the pelagic realm	"The management and conservation of large pelagic fish commonly rely on fisheries data and thus crucially depend on our understanding of the fish response to the fishing gear. Stock assessment of both tropical and temperate tuna strongly leans on the catch statistics derived from pelagic longline ?sheries. However, the role of the spatial distribution of catches of tuna and bycatch species over the gear, that can affect the estimated tuna abundance, is still neglected. In this study, we analyzed data obtained from 147 instrumented pelagic longline sets equipped with hook timers and temperature depth recorders to characterize the distribution of hooking contacts and success at a fine temporal and spatial scale. Scientific surveys were carried out in the Central-South Pacific Ocean (French Polynesia), targeting tropical (Thunnus albacares, T. obesus) and temperate (T. alalunga) tuna. Data analysis based on spatial point processes and stochastic modeling demonstrate the presence of spatio-temporal clusters for both hooking contacts and hooking success. The comparative analysis of the observed spatio-temporal patterns for different oceanographic zones revealed the persistent structure of the clusters, suggesting that they are neither related to local environmental conditions nor to the spatial distribution of preys. "	"Capello, M.; Bach, P.; Romanov, E."	WOS:000328273100012
230436	2013	AS	"Emanuel Mendes da Costa's <i>Conchology, or natural history of shells</i>, a non-binominal work"	A discussion of  names improperly attributed to  this rare book.	"Petit, R.E."	\N
238170	2013	AS	A bioturbation classification of European marine infaunal invertebrates	"Bioturbation, the biogenic modification of sediments through particle reworking and burrow ventilation, is a key mediator of many important geochemical processes in marine systems. In situ quantification of bioturbation can be achieved in a myriad of ways, requiring expert knowledge, technology, and resources not always available, and not feasible in some settings. Where dedicated research programmes do not exist, a practical alternative is the adoption of a trait-based approach to estimate community bioturbation potential (BP<sub>c</sub>). This index can be calculated from inventories of species, abundance and biomass data (routinely available for many systems), and a functional classification of organism traits associated with sediment mixing (less available). Presently, however, there is no agreed standard categorization for the reworking mode and mobility of benthic species. Based on information from the literature and expert opinion, we provide a functional classification for 1033 benthic invertebrate species from the northwest European continental shelf, as a tool to enable the standardized calculation of BP<sub>c</sub> in the region. Future uses of this classification table will increase the comparability and utility of large-scale assessments of ecosystem processes and functioning influenced by bioturbation (e.g., to support legislation). The key strengths, assumptions, and limitations of BP<sub>c</sub> as a metric are critically reviewed, offering guidelines for its calculation and application."	"Queiros, A.M.; Birchenough, S.N.R.; Bremner, J.; Godbold, J.A.; Parker, R.E.; Romero-Ramirez, A.; Reiss, H.; Solan, M.; Somerfield, P.J.; Van Colen, C.; Van Hoey, G.; Widdicombe, S."	WOS:000325486000025
238252	2013	AS	New Mediterranean Marine biodiversity records (June 2013)	"This paper concerns records of species that have extended their distribution in the Mediterranean Sea. The finding of the rare brackish angiosperm <i>Althenia filiformis</i> in the island of Cyprus is interesting since its insertion in the Red Data Book of the Flora of Cyprus is suggested. The following species enriched the flora or fauna lists of the relevant countries: the red alga <i>Sebdenia dichotoma</i> (Greece), the hydrachnid mite <i>Pontarachna adriatica</i> (Slovenia), and the thalassinid <i>Gebiacantha talismani</i> (Turkey). Several alien species were recorded in new Mediterranean localities. The record of the burrowing goby <i>Trypauchen vagina</i> in the North Levantine Sea (Turkish coast), suggests the start of spreading of this Lessepsian immigrant in the Mediterranean Sea. The findings of the following species indicate the extension of their occurrence in the Mediterranean Sea: the foraminifer <i>Amphistegina lobifera</i> (island of Zakynthos, Greece), the medusa <i>Cassiopea andromeda</i> (Syria), the copepod <i>Centropages furcatus</i> (Aegean Sea), the decapod shrimp <i>Melicertus hathor</i> (island of Kastellorizo, Greece), the crab <i>Menoethius monoceros</i> (Gulf of Tunis), the barnacles <i>Balanus trigonus, Megabalanus tintinnabulum, Megabalanus coccopoma</i> and the bivalves <i>Chama asperella, Cucurbitula cymbium</i> (Saronikos Gulf, Greece)."	"Siokou, I.; Ates, A.S.; Ayas, D.; Ben Souissi, J.; Chatterjee, T.; Dimiza, M.; Durgham, H.; Dogrammatzi, K.; Erguden, D.; Gerakaris, V.; Grego, M.; Issaris, Y.; Kadis, K.; Katagan, T.; Kapiris, K.; Katsanevakis, S.; Kerkhof, F.; Papastergiadou, E.; Pesic, V.; Polychronidis, L.; Rifi, M.; Salomidi, M.; Sezgin, M.; Triantaphyllou, M.; Tsiamis, K.; Turan, C.; Tziortzis, I.; d'Udekem d'Acoz, C.; Yaglioglu, D.; Zaouali, J.; Zenetos, A."	WOS:000320294500027
238388	2013	AS	The importance of different spatial scales in determining structural and functional characteristics of deep-sea infauna communities	"The urge to understand spatial distributions of species and communities and their causative processes has continuously instigated the development and testing of conceptual models in spatial ecology. For the deep sea, there is evidence that structural and functional characteristics of benthic communities are regulated by a multitude of biotic and environmental processes that act in concert on different spatial scales, but the spatial patterns are poorly understood compared to those for terrestrial ecosystems. Deep-sea studies generally focus on very limited scale ranges, thereby impairing our understanding of which spatial scales and associated processes are most important in driving structural and functional diversity of communities. Here, we used an extensive integrated dataset of free-living nematodes from deep-sea sediments to unravel the importance of different spatial scales in determining benthic infauna communities. Multiple-factor multivariate permutational analyses were performed on different sets of community descriptors (structure, structural and functional diversity, standing stock). The different spatial scales investigated cover two margins in the northeast Atlantic, several submarine canyons/channel/slope areas, a bathymetrical range of 700-4300 m, different sampling locations at each station, and vertical sediment profiles. The results indicated that the most important spatial scale for structural and functional diversity and standing stock variability is the smallest one; infauna communities changed substantially more with differences between sediment depth layers than with differences associated to larger geographical or bathymetrical scales. Community structure differences were greatest between stations at both margins. Important regulating ecosystem processes and the scale on which they occur are discussed. The results imply that, if we are to improve our understanding of ecosystem patterns of deep-sea infauna and the relevant processes driving their structure, structural and functional diversity, and standing stock, we must pay particular attention to the small-scale heterogeneity or patchiness and the causative mechanisms acting on that scale."	"Ingels, J.; Vanreusel, A."	WOS:000322242700010
238681	2013	M	Sustainability in the coastal urban environment: thematic profiles of resources and their users	\N	"Khan, A.Z.; Le, Q.X.; Corijn, E.; Canters, F. (Ed.)"	\N
218688	2013	AM	Marine invertebrates in traditional medicines	"This chapter reviews the uses of marine invertebrates for medicinal purposes, based on an extensive literature survey. We identified at least 266 species which are prescribed to treat a number of diseases and conditions categories, especially those of the digestive and genitourinary systems. Among the medicinal species, 19 species feature on the IUCN (International Union for Conservation of Nature) Red List and/or are CITES-listed (Convention on International Trade in Endangered Species of Wild Fauna and Flora). This highlights the need to assess the impacts of zootherapy in the context of marine biodiversity conservation. Conservation efforts should also be directed to unprotected species, whose medicinal use is widespread. In addition to biological aspects, economical and sociocultural factors influence the relationship between people and zootherapeutical resources. Therefore, studies bridging ecological, anthropological, and pharmacological aspects of the medicinal use of animals should be fostered. "	"Nóbrega Alves, R.R.; Ribeiro Oliveira, T.P.; Rosa, I.L.; Cunningham, A.B."	\N
222959	2013	AMS	LifeWatch data services: online data processing tools for biodiversity science	\N	"Waumans, F.; Vanhoorne, B.; De Hauwere, N.; Hernandez, F."	\N
231862	2013	AS	Onbekende wateren	\N	"Ballard, R."	\N
232790	2013	AMS	Habitat and ecology of <i>Nephrops norvegicus</i>	"This review summarizes the data on habitat, population ecology and ecosystem roles of Nephrops norvegicus. The species has a broad range in the northeast Atlantic and Mediterranean, although it is possible that small or isolated patches of suitable habitat may not be occupied due to restrictions on larval supply. Nephrops densities are related to the silt-clay content of sediments, with interactions between habitat quality and density indicating competition for resources. An analysis of density-size interactions across fishery functional management units (FUs) suggests that growth is suppressed at high densities due to competition (e. g. in the western Irish Sea), although recruitment dynamics or size-selective mortality may also shape the size structure of populations. Nephrops biomass available across FUs may be similar, reflecting a constant yield due to the inverse relationship between individual size and population density. Gaps in the understanding of Nephrops' ecology reflect uncertain ageing criteria, reliance on fisheries-dependent data and few if any undisturbed habitats in which to examine fisheries-independent interactions."	"Johnson, M.P.; Lordan, C.; Power, A.M."	WOS:000321561100003
238303	2013	AS	"The relationship between sandy beach nematodes and environmental characteristics in two Brazilian sandy beaches (Guanabara Bay, Rio de Janeiro)"	"We investigated if the differences in density and nematode communities of intertidal sediments from two Brazilian sheltered sandy beaches were related to environmental characteristics. The upper tide level (UTL) and the low tide level (LTL) of both beaches were surveyed in January (austral summer) and June 2001 (austral winter) during low-spring tides, by collecting samples of nematodes and sediments. Differences in density between beaches, tidal level and seasons, and nematode community structure were investigated. Sediments from both beaches were composed of medium to very coarse sand. The highest nematode densities were found at the UTL, and significant differences between beaches, tidal levels and months were found. A total of 54 genera were found and the genera composition on both sheltered beaches was similar to other exposed worldwide sandy beaches. The density and structure of the nematode community at both beaches clearly varied along the spatial and temporal scales. Gravel percentage was the most important variable explaining the spatial distribution of the nematodes, determining the four sub-communities; this suggests that the sediment characteristics influence the nematode community, rather than physical hydrodynamic forces. Temperature and salinity were suggested to be important variables affecting the temporal variation."	"Maria, T.F.; Paiva, P.; Vanreusel, A.; Esteves, A.M."	WOS:000321393500020
226259	2013	AS	Spatial data management priorities for assessment of Europe’s coasts and seas	"Systemic understanding of marine and coastal environment needs data integration following a respective concept e.g. multi-dimensional and functional mapping. A number of new activities will improve data supply for coasts and seas. This data needs to be integrated and combined with socio-economic drivers and resulting pressures. Resulting knowledge base should be able to inform effectively ecosystem-based management actions, such as integrated coastal zone management, maritime spatial planning, extension of Natura 2000 areas or climate change adaptation in coastal regions and maritime sectors. Assessment that aims to inform such processes will require rethinking of priorities for spatial data collection and analysis, in particular building on data sharing and standardization, improved spatial data integration, promoting interoperability of relevant information systems and possibility of assimilating different data types in to models. Different aspects of spatial data should be addressed in coherent implementation of spatial data infrastructure."	"Meiner, A."	WOS:000319165900007
226492	2013	AS	Marine bioactivity in Irish waters	"In 2009, the Marine Biodiscovery Laboratory was set-up at the Marine Institute with funds from the Marine Institute and the Beaufort Marine Biodiscovery Research Programme. The Marine Biodiscovery Laboratory has already processed over 130 marine specimens from coastal zones and from the Deep Sea (=3,000 m) within the Marine Irish Exclusive Economic Zone. Beaufort Biodiscovery funded taxonomists are involved in species identification and elucidation of evolutionary relationships. The project approach links sampling, systematics, extraction, microbial metagenomics and biomaterials. The Laboratory consists of approximately 56 m<sup>2</sup> including an extraction and a bioassay suite. The Laboratory samples and assesses marine biological diversity geared towards developing natural products for drug discovery, advanced material applications and bio-medical devices. Samples are tracked from sample log-into right through to extraction and bioassay using a customised Marine Biodiscovery Database. The extraction procedure is described along with the anti-bacterial bioassay selected for routine use. The Marine Biodiscovery Database manages the data generated and links the data collected by the project’s stakeholders to existing biodiversity, genetic and chemical resources. The system uses in-house developed software tools to merge biodiscovery data collected with other MI resources and external databases and for the data mining and visualisation of biogeographical, genetic and chemical information aimed at the identification of potential biodiversity and bioactivity “hotspots”."	"Rae, M.; Folch, H.; Moniz, M.B.J.; Wolff, C.W.; McCormack, G.P.; Rindi, F.; Johnson, M.P."	WOS:000324653400015
227406	2013	AS	"Invisible catch: A century of bycatch and unreported removals in sea fisheries, Belgium 1929-2010"	"Publicly reported statistics on the production of fisheries refer to 'landings' as opposed to 'catch'. However, well-informed decisions and evaluation of the impacts of fisheries on ecosystems must be based on total removals, so including the part of the catch that is discarded at sea or not reported as landings. Total removals by Belgian fisheries from all ICES fishing areas and from the Belgian part of the North Sea (BNS) from 1929 to 2010, were reconstructed by including unreported and misreported landings of the commercial fleet, unreported landings by the recreational and artisanal/subsistence fisheries and by estimating discards for the most important fisheries. Total reconstructed removals were estimated at 5.2 million t or 42% higher than the 3.7 million t publicly reported over this period. Unreported landings and discards were estimated to represent respectively 3.5% (0.2 million t) and 26% (1.3 million t) of these total reconstructed removals. The reconstructed total removals on the BNS were estimated to be 55% higher than the 0.8 million t publicly reported over this period. Discards represent an average annual of 34% of the total removals on the BNS over the entire period. The results suggest that since the 2000s, approximately 50% of all Belgian removals from its EEZ are unreported landings and discards (IUU). The unreported landings and discards are increasingly taken by non-commercial, small-scale (<12 m) vessels that are not subject to reporting and not taken into consideration in planning, monitoring and enforcement. While the present paper provides a first attempt to reconstruct historical total removals for Belgium's sea fisheries, it also addresses the gaps in data and information that need to be resolved to improve the reliability of the estimates of unaccounted removals. The reconstructed time series provides a context for the wider debate about how to move to more sustainable fisheries, what the role of small-scale fisheries are, how to achieve the agreed policy targets in Belgian marine waters and in particular in the marine areas protected under the EU Habitat and Bird directives."	"Lescrauwaet, A.-K.; Torreele, E.; Vincx, M.; Polet, H.; Mees, J."	WOS:000325191900019
229060	2013	AS	A new digital map of limits of oceans and seas consistent with high-resolution global shorelines	"We present a vector map of the limits of oceans and seas intended to be integrated into a geographic information system (GIS). This map is based on the document S-23 titled “Limits of Oceans and Seas” and published by the International Hydrographic Organization (IHO). The third edition of this document, published in 1953, still serves as an official reference. The realization of this map from a text containing numerous ambiguities, disused place-names, or imprecise coordinates required important documentary investigations. This was made possible through the use of online resources such as map libraries, satellite imageries, geographic names databases, and institutional geoportals. The main innovations of our map are its accuracy, its precision of about 10 s of meridian arc, and its consistency with the Global, Self-consistent, Hierarchical, High-resolution Shoreline database and with satellite images such as Land Satellite and moderate-resolution imaging spectroradiometer. All remaining uncertainties for the drawing of limits are presented in the results. Although based on an IHO document, our map does not possess any official status. Nevertheless, we hope that our map will facilitate and encourage more detailed spatial analyses related to oceans and seas. This map is freely available for noncommercial use."	"Fourcy, D.; Lorvelec, O."	WOS:000316162400020
229321	2013	AMS	Marine Regions: towards a standard for georeferenced marine names	\N	"Claus, S.; Souza Dias, F.; Vanhoorne, B.; De Hauwere, N.; Hernandez, F."	\N
230395	2013	M	De morfologie van de platvis met de tong (<i>Solea solea</i> L.) en de schol (<i>Pleuronectes platessa</i> L.) als typevoorbeelden	\N	"De Plecker, L."	\N
230570	2013	AM	Marine research	\N	"Herman, R.; Mees, J.; Pirlet, H.; Verleye, T.J.; Lescrauwaet, A.-K."	\N
231863	2013	AS	Mapping a new America	\N	"Ballard, R."	\N
222908	2013	AMS	Acoustically tagging Atlantic cod - the silver bullet to investigate behaviour?	\N	"Reubens, J.; Degraer, S.; Vincx, M."	\N
222933	2013	AMS	World Register of Marine Species	\N	"Vandepitte, L.; Vanhoorne, B.; Decock, W.; Trias Verbeeck, A.; Dekeyzer, S.; Colpaert, S.; Hernandez, F."	\N
