,DataSystem,Affiliation,Country,Unnamed: 3,Unnamed: 4,Unnamed: 5,stand_affil,similarity_method,stand_country,stand_flemish,stand_GROUP,stand_QH
174,Marine_species,"iNaturalist, California Academy of Scienes and National Geogrraphic Society",United States,,,,California Academy of Sciences,,USA,,University,Science
175,Marine_species,"Reef Life Apps, LLC",Czech Republic,,,,"Reef Life Apps, LLC",,Czech Republic,,Other,Civil society
176,Marine_species,Stichting observation international,Netherlands,,,,observation international,,Global,,Other,Civil society
177,Marine_species,Arctos,United States,,,,Arctos,,USA,,Company,Industry
178,Marine_species,Natural History Museum of Los Angeles County,USA,,,,NHM Natural History Museum of Los Angeles County,,USA,,Museum,Science
179,Marine_species,Leigh Marine Laboratory,New Zealand,,,,University of Auckland - Leigh Marine Laboratory,,New Zealand,,Research institute,Science
180,Marine_species,"Ensenada Center for Scientific Research and Higher Education, CICESE",Mexico,,,,Center for Scientific Research and Higher Education at Ensenada (CICESE),,Mexico,,Research institute,Science
181,Marine_species,National Marine Fisheries Research Institute,Poland,,,,ICAR (International Committee for Animal Recording) - Central Marine Fisheries Research Institute,x,India,,Research institute,Science
182,Marine_species,Virginia Institute of Marine Science,United States,,,,GEOMAR Helmholtz Centre for Ocean Research Kiel,x,Germany,,Research institute,Science
183,Marine_species,Harbor Branch Oceanographic Institution,USA,,,,Florida Atlantic University - Harbor Branch Oceanographic Institute,,USA,,Research institute,Science
184,Marine_species,California Academy of Sciences,United States,,,,California Academy of Sciences,,USA,,University,Science
185,Marine_species,"The Department of Agriculture, Environment and Rural Affairs",UK,,,,"Northern Ireland Executive - Department of Agriculture, Environment and Rural Affairs (DAERA)",,UK,,Governmental body,Policy
186,Marine_species,Northeastern University,USA,,,,Northwest University of China,x,China,,University,Science
187,Marine_species,Revive & Restore,United States,,,,Revive & Restore,,USA,,Company,Industry
188,Marine_species,Virginia Institute of Marine Science,United States,,,,GEOMAR Helmholtz Centre for Ocean Research Kiel,x,Germany,,Research institute,Science
189,Marine_species,Alive Fundació,Spain,,,,Alive Fund,,Spain,,Non-profit organization,Civil society
190,Marine_species,Stony Brook University,United States,,,,Stony Brook University,,,,,
191,Marine_species,Stony Brook University,USA,,,,Stony Brook University,,,,,
192,Marine_species,Monterey Bay Aquarium Research Institute (MBARI),United States,,,,Monterey Bay Aquarium Research Institute (MBARI),x,USA,,Research institute,Science
193,Marine_species,NUI Galway,Ireland,,,,National University of Ireland Galway,,Ireland,,University,Science
194,Marine_species,University of Hawaii at Hilo,United States,,,,University of Hawaii,x,,,,
195,Marine_species,Insitech Partners LLC,United States,,,,Insitech Partners LLC,,USA,,Company,Industry
196,Marine_species,University of Louisiana at Lafayette,United States,,,,University of Louisiana at Lafayette,,USA,,University,Science
197,Marine_species,University Hamburg; Zentrum für Bioinformatik,Germany,,,,University of Hamburg - Center for Bioinformatics,,Germany,,Research institute,Science
198,Marine_species,Dalhousie University,Canada,,,,Dalhousie University,,Canada,,University,Science
199,Marine_species,"Sorbonne Université/CNRS, Laboratoire d'Océanographie de Villefranche",France,,,,UPMC - Laboratoire d'Océanographie de Villefranche (LOV),x,France,,Research institute,Science
200,Marine_species,Thomson Environmental Consultants,United Kingdom,,,,Thomson Environmental Consultants,,UK,,Consultancy,Industry
201,Marine_species,Monterey Bay Aquarium,USA,,,,Monterey Bay Aquarium,,USA,,Museum,Science
202,Marine_species,MPEDA ,India,,,,India government - Marine Products Export Development Authority (MPEDA),,India,,Governmental body,Policy
203,Marine_species,Museums Victoria,Australia,,,,Museums Victoria,,Australia,,Museum,Science
204,Marine_species,Oceana Europe,Belgium,,,,Oceana Europe,,Europe,,Non-profit organization,Civil society
205,Marine_species,University of New Hampshire,United States,,,,University of New Hampshire,,USA,,University,Science
206,Marine_species,Fugro GB Marine Ltd,United Kingdom,,,,Fugro,,Global,,Consultancy,Industry
207,Marine_species,University of New Hampshire,USA,,,,University of New Hampshire,,USA,,University,Science
208,Marine_species,University of New Hampshire,USA,,,,University of New Hampshire,,USA,,University,Science
209,Marine_species,University of Helsinki,Finland,,,,University of Helsinki,,Finland,,University,Science
210,Marine_species,"Fisheries and Oceans Canada, Pacific Biological Station",Canada,,,,Government of Canada - Fisheries and Oceans Canada - Pacific Biological Station,,,,,
211,Marine_species,Department of Fisheries and Oceans,Canada,,,,Government of Canada - Fisheries and Oceans Canada,,Canada,,Governmental body,Policy
212,Marine_species,"National Institutes of Health, National Center for Biotechnology Information",United States,,,,National Center for Biotechnology Information (NCBI),,USA,,Data infrastructure,Science
213,Marine_species,University of Plymouth,UK,,,,University of Plymouth,,UK,,University,Science
214,Marine_species,National Research Council of Italy,Italy,,,,National Research Council (CNR),x,Italy,,Governmental body,Policy
215,Marine_species,Hawaii Institute of Marine Biology,Hawaii; U.S.A.,,,,University of Hawaii - Institute of Marine Biology,,USA,,Research institute,Science
216,Marine_species,Galway Marine Institute - Foras na Mara,Ireland,,,,Marine Institute,,Ireland,,Research institute,Science
217,Marine_species,Yale University,United States,,,,Yale University,,USA,,University,Science
218,Marine_species,National University of Ireland Galway,Ireland,,,,National University of Ireland Galway,,Ireland,,University,Science
219,Marine_species,"Museu de Ciències Naturals de Barcelona, Department of Palaeontology",Spain,,,,Museum of Natural Sciences of Barcelona - Department of Palaeontology,,Spain,,Museum,Science
220,Marine_species,Third Institute of Oceanography,China,,,,Government of Canada - Fisheries and Oceans Canada - Bedford Institute of Oceanography,x,Canada,,Research institute,Science
221,Marine_species,Beijing Genomics Institute (BGI),China,,,,Beijing Genomics Institute (BGI),,China,,Company,Industry
222,Marine_species,None,Finland,,,,,,,,,
223,Marine_species,"Taiwan Biodiversity Information Facility (TaiBIF), Biodiversity Research Centre,  Academia Sinica",Taiwan (Province of China),,,,Academia Sinica - Biodiversity Research Centre - Taiwan Biodiversity Information Facility (TaiBIF),x,Taiwan,,Data infrastructure,Science
224,Marine_species,Western Pacific Regional Fishery Management Council,United States,,,,Western Pacific Regional Fishery Management Council,,USA,,Governmental body,Policy
225,Marine_species,CNRS IMBE: Mediterranean institute of Biodiversity and Ecology (marine and continental),France,,,,CNRS - Mediterranean institute of Biodiversity and Ecology IMBE,,France,,Research institute,Science
226,Marine_species,Cercle Geologique du Hainaut,France,,,,Cercle Geologique du Hainaut,,France,,Research institute,Science
227,Marine_species,European Commission - DG SANTE,Belgium,,,,EU - European Commission -  DG SANTE (DG for Health and Food Safety),x,Europe,,EU institution,Policy
228,Marine_species,University of British Columbia,Canada,,,,University of British Columbia,,Canada,,University,Science
229,Marine_species,College of Marine Life Science Ocean University of China,China,,,,Ocean University of China - College of Marine Life Sciences,,China,,University,Science
230,Marine_species,Hellenic Centre for Marine Research,Greece,,,,HCMR (Hellenic Centre for Marine Research),,Greece,,Research institute,Science
231,Marine_species,NOAA-NCEI,United States,,,,NOAA National Oceanic And Atmospheric Administration - NCEI National Centers for Environmental Information,,USA,,Governmental body,Policy
232,Marine_species,Hopkins Marine Station,USA,,,,Stanford University - Hopkins Marine Station,,USA,,Research institute,Science
233,Marine_species,Beijing Genomics Institute (BGI),China,,,,Beijing Genomics Institute (BGI),,China,,Company,Industry
234,Marine_species,Northwest University,China,,,,Northwest University of China,,China,,University,Science
235,Marine_species,Ocean Networks Canada,Canada,,,,University of Victoria - Ocean Networks Canada,,Canada,,University,Science
236,Marine_species,University of Southampton,United Kingdom,,,,University of Southampton,,UK,,University,Science
237,Marine_species,Universiteit Gent,Belgium,,,,Ghent University,,Belgium,x,University,Science
238,Marine_species,Murdoch University,Australia,,,,Murdoch University,x,Australia,,University,Science
239,Marine_species,CEFAS,United Kingdom,,,,"CEFAS (Centre for Environment, Fisheries and Aquaculture Science)",,UK,,Research institute,Science
240,Marine_species,Universidad de Murcia,Spain,,,,University of Murcia,,Spain,,University,Science
241,Marine_species,Individual,Australia,,,,personal,,,,,
242,Marine_species,University of Pretoria,South-Africa,,,,University of Florida,x,USA,,University,Science
243,Marine_species,Executive Environmnet Agency,Bulgaria,,,,Ministry of Environment and Water - Executive Environment Agency (ExEA),,Bulgaria,,Governmental body,Policy
244,Marine_species,Yale University,United States,,,,Yale University,,USA,,University,Science
245,Marine_species,Scottish Environment Protection Agency,United Kingdom,,,,US Environmental Protection Agency (US EPA),x,USA,,Governmental body,Policy
246,Marine_species,Australian Antarctic Data Centre,Australia,,,,Australian Antarctic Data Centre,,Australia,,Data infrastructure,Science
247,Marine_species,Senckenberg Nature Research Society,Germany,,,,Senckenberg Nature Research Society,,Germany,,research network,Science
248,Marine_species,Victoria University of Wellington,New Zealand,,,,Victoria University of wellington,x,New Zealand,,University,Science
249,Marine_species,Zoological Society of London,United Kingdom,,,,Zoological Society of London,,UK,,Non-profit organization,Policy
250,Marine_species,Imperial College London,United Kingdom,,,,Imperial College London,,,,,
251,Marine_species,University Hamburg; Zentrum für Bioinformatik,Germany,,,,University of Hamburg - Center for Bioinformatics,,Germany,,Research institute,Science
252,Marine_species,"University of California,  Berkeley",United States,,,,"University of California, Berkeley",x,USA,,University,Science
253,Marine_species,University of Guelph,Canada,,,,University of Hull,x,UK,,University,Science
254,Marine_species,Missouri Botanical Garden,United States,,,,Plantentuin Meise,x,Belgium,x,Museum,Science
255,Marine_species, BASF SE,Germany,,,,BASF,x,Global,,Company,Industry
256,Marine_species,Axiom Data Science,United States,,,,Axiom Data Science,,USA,,Data infrastructure,Science
257,Marine_species,cefas,United Kingdom,,,,,,,,,
258,Marine_species,Field Museum of Natural History,United States,,,,Swedish Museum of Natural History,x,Sweden,,Museum,Science
259,Marine_species,Marine Institute Ireland,Ireland,,,,Marine Institute,x,Ireland,,Research institute,Science
260,Marine_species,Senckenberg Research Institute and Natural History Museum,Germany,,,,Naturmuseum Senckenberg - Research Institute and Natural History Museum Frankfurt,,Germany,,Research institute,Science
261,Marine_species,"Muséum national d'Histoire naturelle (MNHN), Paris",France,,,,MNHN National Museum of Natural History,x,France,,Museum,Science
262,Marine_species,Barcode of Life Datasystem (BOLD) - Centre for Biodiversity Genomics (CBG) ,Canada,,,,Barcode of Life Data System (BOLDSystems),,Global,,Data infrastructure,Science
263,Marine_species,Draper,United States,,,,Draper Inc. ,,USA,,Company,Industry
264,Marine_species,European Bioinformatics Institute,UK,,,,EMBL (European Molecular Biology Laboratory) - EBI (European Bioinformatics Institute),,Europe,,Research network,Science
265,Marine_species,Eco Marine Consultants,United Kingdom,,,,Eco Marine Consultants,,UK,,Consultancy,Industry
266,Marine_species,Station Biologique de Roscoff - CNRS - Sorbonne Université,France,,,,Station Biologique de Roscoff,,,,,
267,Marine_species," R/V Atlantis, and R/V Mirai Cruises.Scripps Institution of Oceanography",USA,,,,"University of California, San Diego (UCSD) - Scripps Institution of Oceanography",,USA,,Research institute,Science
268,Marine_species,"Canadian National Collection of Insects,  Arachnids & Nematodes",Canada,,,,"Ottawa Research and Development Centre - Canadian National Collection of Insects, Arachnids & Nematodes",x,Canada,,Research institute,Science
269,Marine_species,Haus der Natur Salzburg,Austria,,,,Haus der Natur Salzburg,,Austria,,Museum,Science
270,Marine_species,Natural History Museum Rotterdam,Netherlands,,,,Natural History Museum Rotterdam (NMR),x,Netherlands,,Museum,Science
271,Marine_species,Centre for Marine Environmental Sciences,Germany,,,,MARUM - Center for Marine Environmental Sciences,x,Germany,,Research institute,Science
272,Marine_species,University Hamburg; Center for Natural History,Germany,,,,University of Hamburg - Center for Natural History,,,,,
273,Marine_species,American Museum of Natural History,USA,,,,American Museum of Natural History (AMNH),,USA,,Museum,Science
274,Marine_species,Universidade Federal Fluminense,Brazil,,,,Fluminense Federal University,x,Brazil,,University,Science
275,Marine_species,Selkirk College,Canada,,,,Selkirk College,,Canada,,University,Science
276,Marine_species,Dalhousie Univeristy,Canada,,,,Dalhousie University,x,Canada,,University,Science
277,Marine_species,"Biodiversity Research Center, Academia Sinica",Taiwan (Province of China),,,,Academia Sinica - Biodiversity Research Centre,,Taiwan,,Research institute,Science
278,Marine_species,,USA,,,,,,,,,
279,Marine_species,"Add-my-Pet portal ,  Vrije Universiteit van Amsterdam",Netherlands,,,,Add-my-Pet (AmP) ,x,Netherlands,,Data infrastructure,Science
280,Marine_species,"Archaeology and Natural History,  The Australian National University",Australia,,,,Australian National University - Archaeology and Natural History,x,Australia,,University,Science
281,Marine_species,"Base pour l'Inventaire des Observations Subaquatiques (BioObs), ",France,,,,BioObs (Base pour l'inventaire des observations subaquatiques),,France,,Data infrastructure,Science
282,Marine_species,"Biodata Mining Group,  Bielefeld University",Germany,,,,Bielefeld University - Biodata Mining Group,,,,,
283,Marine_species,"Biodiversity Virtual e-Laboratory (BioVeL) Project,  Cardiff University",UK,,,,Cardiff University,,UK,,University,Science
284,Marine_species,"Biological Information System for Marine Life (BISMaL), ",Japan,,,,JAMSTEC (Japan Agency for Marine-Earth Science and Technology) - Biological Information System for Marine Life (BISMaL),,Japan,,Data infrastructure,Science
285,Marine_species,"BlueBRIDGE,  Italian National Research Council",Italy,,,,BlueBRIDGE,x,New Zealand,,Consultancy,Industry
286,Marine_species,"British Oceanographic Data Centre (BODC), ",UK,,,,British Oceanographic Data Centre (BODC),x,UK,,Data infrastructure,Science
287,Marine_species,"Check the current taxonomic classification benthic surveys samples,  Centre for Environment, Fisheries and Aquaculture Science",UK,,,,"CEFAS (Centre for Environment, Fisheries and Aquaculture Science)",x,UK,,Research institute,Science
288,Marine_species,"Circolo Attività Subacquee Chieri,  Sezione Didattica",Italy,,,,Chieri Underwater Activities Club,x,Italy,,Other,Civil society
289,Marine_species,"Citizen Science non profit group opistobranquis.info ,  VIMAR - Vida Marina ",Spain,,,,VIMAR (Vida Marina),x,,,,
290,Marine_species,"Coral Reef Ecosystem Division (CRED),  NOAA",USA,,,,NOAA National Oceanic And Atmospheric Administration - Coral Reef Ecosystem Division (CRED),,,,,
291,Marine_species,"CRITTERBASE project,  Alfred Wegener Institute for Polar- and Marine Research",Germany,,,,CRITTERBASE,x,Germany,,Data infrastructure,Science
292,Marine_species,"DAERA.Marine taxon application (new version of UNICORN) ,  The Department of Agriculture, Environment and Rural Affairs",UK,,,,"Northern Ireland Executive - Department of Agriculture, Environment and Rural Affairs (DAERA)",x,UK,,Governmental body,Policy
293,Marine_species,"Data Publisher for Earth & Environmental Science (PANGAEA) ,  Centre for Marine Environmental Sciences",Germany,,,,PANGAEA,x,Germany,,Data infrastructure,Science
294,Marine_species,"Department of Marine Sciences,  University of the Aegean",Greece,,,,University of the Aegean - Department of Marine Sciences,x,Greece,,University,Science
295,Marine_species,"Données d'Observations pour la Reconnaissance et l'Identification de la faune et de la flore Subaquatique (DORIS), ",France,,,,Données d'Observations pour la Reconnaissance et l'Identification de la faune et la flore Subaquatiques (DORIS),x,France,,Data infrastructure,Science
296,Marine_species,"Ecopath with Ecosim (EwE),  University of British Columbia",Canada,,,,University of British Columbia - Ecopath with Ecosim (EwE),,,,,
297,Marine_species,"Ecospan Environmental Limited, ",UK,,,,Ecospan Environmental Limited,x,UK,,Company,Industry
298,Marine_species,"EMODNet Portal for Biology, ",EU,,,,EMODNet (European Marine Observation and Data Network) - Biology,x,Europe,,Data infrastructure,Science
299,Marine_species,"Encyclopedia of Life,  Smithsonian Institution",USA,,,,Smithsonian Institution - Smithsonian National Museum of Natural History - Encyclopedia of Life (EOL),x,USA,,Data infrastructure,Science
300,Marine_species,"Environmental Information Management (EIM) database,  Washington State Department of Ecology",USA,,,,Washington State Department of Ecology - Environmental Information Management (EIM) database,,USA,,Data infrastructure,Science
301,Marine_species,"ETI BioInformatics, ",Netherlands,,,,ETI BioInformatics,x,Netherlands,,Company,Industry
302,Marine_species,"European Environment Agency,  EUNIS",Denmark,,,,EU - European Environmental Agency - EUNIS (European Nature Information System),x,Europe,,Data infrastructure,Science
303,Marine_species,"Fisheries Linked Open Data at the Fisheries and Aquaculture Department of FAO, ",Italy,,,,FAO (Food and Agriculture Organization of the United Nations) - Fisheries and Aquaculture Department - Fisheries Linked Open Data (FLOD),x,,,,
304,Marine_species,"Foraminifera.eu Project, ",Germany,,,,Foraminifera.eu,,Europe,,Creative body,Science
305,Marine_species,"Gaiaguide, ",Australia,,,,,,,,,
306,Marine_species,"Gardline Marine Sciences group, ",UK,,,,Gardline Group - Marine Sciences group,x,Global,,Company,Industry
307,Marine_species,"GenBank,  National Center for Biotechnology Information (NCBI)",USA,,,,National Center for Biotechnology Information (NCBI),x,USA,,Data infrastructure,Science
308,Marine_species,"Global Biotic Interactions (GloBI), ",Oakland,,,,Global Biotic Interactions (GloBI),,,,,
309,Marine_species,"Global Genome Initiative,  Smithsonian Institution",US,,,,Smithsonian Institution - Smithsonian National Museum of Natural History - Global Genome Initiative (GGI),x,USA,,Museum,Science
310,Marine_species,"Hafok, ",Sweden,,,,Hafok AB,x,Sweden,,Consultancy,Industry
311,Marine_species,"Harbor Branch Oceanographic Institute,  Florida Atlantic University",USA,,,,Florida Atlantic University - Harbor Branch Oceanographic Institute,,USA,,Research institute,Science
312,Marine_species,"HELCOM,  Helsinki",Finland,,,,HELCOM (Helsinki Convention on the Protection of the Marine Environment of the Baltic Sea Area),x,Finland,,Governmental body,Policy
313,Marine_species,"Ifremer,  Laboratoire des sciences de l’Environnement MARin (LEMAR)",France,,,,IFREMER Institut Français de Recherche pour l'Exploitation de la Mer - Laboratoire des sciences de l’Environnement MARin (LEMAR),x,,,,
314,Marine_species,"iMarine Project, ",Europe,,,,iMarine,,Europe,,Data infrastructure,Science
315,Marine_species,"iNaturalist ,  California Academy of Sciences",USA,,,,California Academy of Sciences,x,USA,,University,Science
316,Marine_species,"Information about non domestic animals keeping ,  Base de Données des Espèces Non Domestiques (BDEND)",France,,,,Bases de données des espèces non-domestiques (BDEND),x,France,,Data infrastructure,Science
317,Marine_species,"Information system on Aquatic Non-Indigenous and Cryptogenic Species (AquaNIS), ",Lithuania,,,,Information system on Aquatic Non-Indigenous and Cryptogenic Species (AquaNIS),,Global,,Data infrastructure,Science
318,Marine_species,"Institut de Recherche pour le Développement (IRD),  Centre de Recherche Halieutique Méditerranéenne et Tropicale",France,,,,IRD L'Institut de recherche pour le développement - Centre de Recherche Halieutique Méditerranéenne et Tropicale,x,France,,Research institute,Science
319,Marine_species,"Institut National de Recherche Halieutique (INRH), ",Morocco,,,,Institut National de Recherche Halieutique (INRH),x,Morocco,,Research institute,Science
320,Marine_species,"International Institute for Species Exploration, ",USA,,,,International Institute for Species Exploration,x,,,,
321,Marine_species,"keep abreast with changes in the taxonomy,  Institute for Marine Resources and Ecosystem Studies",Netherlands,,,,IMARES - Wageningen Marine Research (WUR),x,,,,
322,Marine_species,"Keep the nomenclature up-to-date,  Natural History Collections of Tyrolean State Museum Ferdinandeum",Austria,,,,Natural History Collections of Tyrolean State Museum Ferdinandeum,,Austria,,Museum,Science
323,Marine_species,"L’Agence des aires marines protégées, ",France,,,,L’Agence des aires marines protégées,x,France,,Governmental body,Policy
324,Marine_species,"MariLim Gesellschaft für Gewässeruntersuchung mbH, ",Germany,,,,MariLim GmbH,x,Germany,,Consultancy,Industry
325,Marine_species,"Marine Life Information Network (MarLIN), ",UK,,,,MarLIN (Marine Life Information Network),x,UK,,Data infrastructure,Science
326,Marine_species,"Marine Research Lab,  Zoological Institute RAS",Russia,,,,"Russian Academy of Sciences (RAS) - Zoological Institute, Marine Research Lab",x,Russia,,Research institute,Science
327,Marine_species,"Marine Resource Modelling Group,  University of Strathclyde Dept. Mathematics and Statistics",UK,,,,University of Strathclyde - Department of Mathematics and Statistics - Marine Resource Modelling Group,,UK,,University,Science
328,Marine_species,"Maurice Lamontagne Institute,  Fisheries and Oceans",Canada,,,,Government of Canada - Fisheries and Oceans Canada - Maurice Lamontagne Institute,x,Canada,,Research institute,Science
329,Marine_species,"Mikrotax.org - pforams,  University College London",UK,,,,University College London,,UK,,University,Science
330,Marine_species,"MIT Sea Grant College Program, ",USA,,,,Massachusetts Institute of Technology (MIT) - Sea Grant College Program,,USA,,Data infrastructure,Science
331,Marine_species,"National Academy of Sciences of Ukraine,  Institute of Biology of the Southern Seas (IBSS)",Ukraine,,,,National Academy of Sciences of Ukraine (NASU) - AO Kovalevsky Institute of Biology of the Southern Seas (IBSS),x,Ukraine,,Research institute,Science
332,Marine_species,"National benthic database,  University of Bordeaux",France,,,,University of Bordeaux - National benthic database,,France,,Data infrastructure,Science
333,Marine_species,"Nationalpark-Verwaltung Niedersächsisches Wattenmeer,  Wilhelmshaven",Germany,,,,Nationalpark Niedersächsisches Wattenmeer,x,Germany,,Other public authorities,Policy
334,Marine_species,"Natura Esperire/Experience Annalisa Tassini, ",Italy,,,,Natura Esperire/Experience Annalisa Tassini,x,Italy,,Other,Civil society
335,Marine_species,"Natural History Museum of Los Angeles County, ",USA,,,,NHM Natural History Museum of Los Angeles County,x,USA,,Museum,Science
336,Marine_species,"Natural History Museum Rotterdam,  Marine Invertebrates",Netherlands,,,,Natural History Museum Rotterdam (NMR) - Marine Invertebrates,x,Netherlands,,Museum,Science
337,Marine_species,"Observation.org, ",Netherlands,,,,"Observation.org, ",,Global,,Data infrastructure,Science
338,Marine_species,"Opale Surfcasting, ",France,,,,Opale Surfcasting,,Global,,Creative body,Civil society
339,Marine_species,"Open Tree of Life, ",USA,,,,Open Tree of Life,,Global,,Data infrastructure,Science
340,Marine_species,"PAPARA(ZZ)I Annotation tool,  Alfred Wegener Institute",Germany,,,,Alfred Wegener Institute for Polar and Marine Research (AWI) - PAPARA(ZZ)I Annotation tool,,Germany,,Data infrastructure,Science
341,Marine_species,"Pelagos & Assemble databases,  Station Biologique de Roscoff",France,,,,Station Biologique de Roscoff,,,,,
342,Marine_species,"PhD on taxonomy of cyclopoida,  University of Baghdad",Iraq,,,,University of Baghdad,,Iraq,,University,Science
343,Marine_species,"Referred to webservices - WoRMS data (through the Lifewatch Species Information Backbon) will be used for updating taxon names in the internal databases of the Cawthron Institute,  Cawthron Institute",New Zealand,,,,Cawthron Institute,,New Zealand,,Research institute,Science
344,Marine_species,"Resolve common names for Central & Northern California Ocean Observing System (CeNCOOS) ,  Research Institute",USA,,,,Central and Northern California Ocean Observing System (CeNCOOS),x,USA,,Data infrastructure,Science
345,Marine_species,"Russell Renka - Shell List,  Southeast Missouri State University",USA,,,,Southeast Missouri State University,,USA,,University,Science
346,Marine_species,"San Diego Supercomputer Center, ",USA,,,,"University of California, San Diego (UCSD) - San Diego Supercomputer Center",x,USA,,Research institute,Science
